GO,Term_Name_Clean,P-value,Z-score,Combined_Score
GO:0010950,Positive Regulation Of Endopeptidase Activity,0.0035644056406878,2.923301119803651,16.47794085571158
GO:0006937,Regulation Of Muscle Contraction,0.0035644056406878,2.923301119803651,16.47794085571158
GO:0120039,Plasma Membrane Bounded Cell Projection Morphogenesis,0.0036044780170414,2.236559139784946,12.58193859227494
GO:0010821,Regulation Of Mitochondrion Organization,0.0036044780170414,2.236559139784946,12.58193859227494
GO:0036499,PERK-mediated Unfolded Protein Response,0.0037235424281285,67320.0,376526.13201404334
GO:0006086,acetyl-CoA Biosynthetic Process From Pyruvate,0.0037235424281285,67320.0,376526.13201404334
GO:0097647,Amylin Receptor Signaling Pathway,0.0037235424281285,67320.0,376526.13201404334
GO:0086073,Bundle Of His cell-Purkinje Myocyte Adhesion Involved In Cell Communication,0.0037235424281285,67320.0,376526.13201404334
GO:0071910,Determination Of Liver Left/Right Asymmetry,0.0037235424281285,67320.0,376526.13201404334
GO:0050957,Equilibrioception,0.0037235424281285,67320.0,376526.13201404334
GO:0006704,Glucocorticoid Biosynthetic Process,0.0037235424281285,67320.0,376526.13201404334
GO:0033152,Immunoglobulin V(D)J Recombination,0.0037235424281285,67320.0,376526.13201404334
GO:0035771,Interleukin-4-Mediated Signaling Pathway,0.0037235424281285,67320.0,376526.13201404334
GO:0038043,Interleukin-5-Mediated Signaling Pathway,0.0037235424281285,67320.0,376526.13201404334
GO:0030643,Intracellular Phosphate Ion Homeostasis,0.0037235424281285,67320.0,376526.13201404334
GO:0043570,Maintenance Of DNA Repeat Elements,0.0037235424281285,67320.0,376526.13201404334
GO:0000965,Mitochondrial RNA 3'-End Processing,0.0037235424281285,67320.0,376526.13201404334
GO:0070125,Mitochondrial Translational Elongation,0.0037235424281285,67320.0,376526.13201404334
GO:0006297,"Nucleotide-Excision Repair, DNA Gap Filling",0.0037235424281285,67320.0,376526.13201404334
GO:0007231,Osmosensory Signaling Pathway,0.0037235424281285,67320.0,376526.13201404334
GO:0015846,Polyamine Transport,0.0037235424281285,67320.0,376526.13201404334
GO:0032927,Positive Regulation Of Activin Receptor Signaling Pathway,0.0037235424281285,67320.0,376526.13201404334
GO:1905941,Positive Regulation Of Gonad Development,0.0037235424281285,67320.0,376526.13201404334
GO:2000020,Positive Regulation Of Male Gonad Development,0.0037235424281285,67320.0,376526.13201404334
GO:1905065,Positive Regulation Of Vascular Associated Smooth Muscle Cell Differentiation,0.0037235424281285,67320.0,376526.13201404334
GO:0060134,Prepulse Inhibition,0.0037235424281285,67320.0,376526.13201404334
GO:0048793,Pronephros Development,0.0037235424281285,67320.0,376526.13201404334
GO:0071569,Protein Ufmylation,0.0037235424281285,67320.0,376526.13201404334
GO:0031282,Regulation Of Guanylate Cyclase Activity,0.0037235424281285,67320.0,376526.13201404334
GO:0051969,Regulation Of Transmission Of Nerve Impulse,0.0037235424281285,67320.0,376526.13201404334
GO:0002828,Regulation Of Type 2 Immune Response,0.0037235424281285,67320.0,376526.13201404334
GO:0060373,Regulation Of Ventricular Cardiac Muscle Cell Membrane Depolarization,0.0037235424281285,67320.0,376526.13201404334
GO:0061458,Reproductive System Development,0.0037235424281285,67320.0,376526.13201404334
GO:1990776,Response To Angiotensin,0.0037235424281285,67320.0,376526.13201404334
GO:0070305,Response To cGMP,0.0037235424281285,67320.0,376526.13201404334
GO:0019626,Short-Chain Fatty Acid Catabolic Process,0.0037235424281285,67320.0,376526.13201404334
GO:0014897,Striated Muscle Hypertrophy,0.0037235424281285,67320.0,376526.13201404334
GO:0015744,Succinate Transport,0.0037235424281285,67320.0,376526.13201404334
GO:0071934,Thiamine Transmembrane Transport,0.0037235424281285,67320.0,376526.13201404334
GO:1990962,Xenobiotic Transport Across Blood-Brain Barrier,0.0037235424281285,67320.0,376526.13201404334
GO:0080171,Lytic Vacuole Organization,0.0038387352271553,2.579803560466544,14.350447106204188
GO:0045639,Positive Regulation Of Myeloid Cell Differentiation,0.0038387352271553,2.579803560466544,14.350447106204188
GO:0010863,Positive Regulation Of Phospholipase C Activity,0.0038387352271553,2.579803560466544,14.350447106204188
GO:0034446,Substrate Adhesion-Dependent Cell Spreading,0.0038387352271553,2.579803560466544,14.350447106204188
GO:0006869,Lipid Transport,0.0039232511039757,1.7161964084622965,9.50916045010412
GO:0045727,Positive Regulation Of Translation,0.0039232511039757,1.7161964084622965,9.50916045010412
GO:0071824,protein-DNA Complex Organization,0.003966625045753,2.064863203197049,11.418362434040448
GO:0032526,Response To Retinoic Acid,0.003966625045753,2.064863203197049,11.418362434040448
GO:0045786,Negative Regulation Of Cell Cycle,0.003986497183518,1.836206896551724,10.144753593346826
GO:0071364,Cellular Response To Epidermal Growth Factor Stimulus,0.0040179401088028,3.0012269938650307,16.557727063147457
GO:0009953,Dorsal/Ventral Pattern Formation,0.0040179401088028,3.0012269938650307,16.557727063147457
GO:0072666,Establishment Of Protein Localization To Vacuole,0.0040179401088028,3.0012269938650307,16.557727063147457
GO:0016226,Iron-Sulfur Cluster Assembly,0.0040179401088028,3.0012269938650307,16.557727063147457
GO:0031163,Metallo-Sulfur Cluster Assembly,0.0040179401088028,3.0012269938650307,16.557727063147457
GO:0050768,Negative Regulation Of Neurogenesis,0.0040179401088028,3.0012269938650307,16.557727063147457
GO:0002637,Regulation Of Immunoglobulin Production,0.0040179401088028,3.0012269938650307,16.557727063147457
GO:0090140,Regulation Of Mitochondrial Fission,0.0040179401088028,3.0012269938650307,16.557727063147457
GO:0042102,Positive Regulation Of T Cell Proliferation,0.0040535594980034,2.002460024600246,11.02986999977299
GO:0030510,Regulation Of BMP Signaling Pathway,0.0040871284570348,1.906508875739645,10.485632272058536
GO:0008593,Regulation Of Notch Signaling Pathway,0.0040908183224168,1.9504767763765,10.725691785895906
GO:0051101,Regulation Of DNA Binding,0.0041582392653711,2.243861558699993,12.302337974244768
GO:0071300,Cellular Response To Retinoic Acid,0.004385262151328,2.3899132233408205,12.976047878002026
GO:0048524,Positive Regulation Of Viral Process,0.004385262151328,2.3899132233408205,12.976047878002026
GO:0050773,Regulation Of Dendrite Development,0.004385262151328,2.3899132233408205,12.976047878002026
GO:0090199,Regulation Of Release Of Cytochrome C From Mitochondria,0.004385262151328,2.3899132233408205,12.976047878002026
GO:2000278,Regulation Of DNA Biosynthetic Process,0.0043936254923176,2.61399416909621,14.187716164421529
GO:0045785,Positive Regulation Of Cell Adhesion,0.0044753781854638,1.80203102222659,9.747482089358869
GO:0071331,Cellular Response To Hexose Stimulus,0.0045134662482912,3.094770740683944,16.7138969310022
GO:0099565,"Chemical Synaptic Transmission, Postsynaptic",0.0045134662482912,3.094770740683944,16.7138969310022
GO:1903051,Negative Regulation Of Proteolysis Involved In Protein Catabolic Process,0.0045134662482912,3.094770740683944,16.7138969310022
GO:1903573,Negative Regulation Of Response To Endoplasmic Reticulum Stress,0.0045134662482912,3.094770740683944,16.7138969310022
GO:0030316,Osteoclast Differentiation,0.0045134662482912,3.094770740683944,16.7138969310022
GO:0050864,Regulation Of B Cell Activation,0.0045134662482912,3.094770740683944,16.7138969310022
GO:0070167,Regulation Of Biomineral Tissue Development,0.0045134662482912,3.094770740683944,16.7138969310022
GO:0003229,Ventricular Cardiac Muscle Tissue Development,0.0045134662482912,3.094770740683944,16.7138969310022
GO:0032760,Positive Regulation Of Tumor Necrosis Factor Production,0.0046571299017712,1.863892756484112,10.007903609063172
GO:0051493,Regulation Of Cytoskeleton Organization,0.0046836739172752,1.6728494327569114,8.97261641876316
GO:0045216,Cell-Cell Junction Organization,0.004714783538408,1.9470442213483887,10.430417671780951
GO:0043123,Positive Regulation Of I-kappaB kinase/NF-kappaB Signaling,0.0047271545431342,1.5151211499980082,8.112612917919702
GO:0050853,B Cell Receptor Signaling Pathway,0.004798982227002,2.251842751842752,12.023379793750353
GO:0022411,Cellular Component Disassembly,0.004798982227002,2.251842751842752,12.023379793750353
GO:0046546,Development Of Primary Male Sexual Characteristics,0.004798982227002,2.251842751842752,12.023379793750353
GO:0010631,Epithelial Cell Migration,0.004798982227002,2.251842751842752,12.023379793750353
GO:0032435,Negative Regulation Of Proteasomal Ubiquitin-Dependent Protein Catabolic Process,0.0050253947463449,2.653092534958138,14.043485434434707
GO:0051353,Positive Regulation Of Oxidoreductase Activity,0.0050474128246585,3.209138301134621,16.972745705887984
GO:0010830,Regulation Of Myotube Differentiation,0.0050474128246585,3.209138301134621,16.972745705887984
GO:0050658,RNA Transport,0.0050495165290178,2.407828089025326,12.733709222480917
GO:0008543,Fibroblast Growth Factor Receptor Signaling Pathway,0.0050495165290178,2.407828089025326,12.733709222480917
GO:0010823,Negative Regulation Of Mitochondrion Organization,0.0050495165290178,2.407828089025326,12.733709222480917
GO:0032467,Positive Regulation Of Cytokinesis,0.0050495165290178,2.407828089025326,12.733709222480917
GO:0046889,Positive Regulation Of Lipid Biosynthetic Process,0.0050495165290178,2.407828089025326,12.733709222480917
GO:0051881,Regulation Of Mitochondrial Membrane Potential,0.0050495165290178,2.407828089025326,12.733709222480917
GO:0016525,Negative Regulation Of Angiogenesis,0.0051337968773953,1.7961554936817306,9.469169680341732
GO:0007088,Regulation Of Mitotic Nuclear Division,0.005287922198043,2.064535955746773,10.822978548692278
GO:0009062,Fatty Acid Catabolic Process,0.0053966914448851,1.998105966700713,10.43404783358726
GO:0022617,Extracellular Matrix Disassembly,0.0055407981954293,2.260599679761357,11.745209470797612
GO:0034655,Nucleobase-Containing Compound Catabolic Process,0.0055407981954293,2.260599679761357,11.745209470797612
GO:0046854,Phosphatidylinositol Phosphate Biosynthetic Process,0.0055407981954293,2.260599679761357,11.745209470797612
GO:0070168,Negative Regulation Of Biomineral Tissue Development,0.0056113580039792,3.352138586539936,17.374008656874093
GO:0010971,Positive Regulation Of G2/M Transition Of Mitotic Cell Cycle,0.0056113580039792,3.352138586539936,17.374008656874093
GO:0002726,Positive Regulation Of T Cell Cytokine Production,0.0056113580039792,3.352138586539936,17.374008656874093
GO:0045880,Positive Regulation Of Smoothened Signaling Pathway,0.0056113580039792,3.352138586539936,17.374008656874093
GO:0046686,Response To Cadmium Ion,0.0056113580039792,3.352138586539936,17.374008656874093
GO:0006508,Proteolysis,0.0056890877960925,1.345863253200125,6.957043543247868
GO:0006954,Inflammatory Response,0.0057339212997939,1.4187045252883763,7.322438598549862
GO:0007129,Homologous Chromosome Pairing At Meiosis,0.005743071373244,2.698231205824395,13.9222284937027
GO:0007095,Mitotic G2 DNA Damage Checkpoint Signaling,0.005743071373244,2.698231205824395,13.9222284937027
GO:0030195,Negative Regulation Of Blood Coagulation,0.005743071373244,2.698231205824395,13.9222284937027
GO:0045912,Negative Regulation Of Carbohydrate Metabolic Process,0.005743071373244,2.698231205824395,13.9222284937027
GO:0010719,Negative Regulation Of Epithelial To Mesenchymal Transition,0.005743071373244,2.698231205824395,13.9222284937027
GO:0048662,Negative Regulation Of Smooth Muscle Cell Proliferation,0.0058152563843103,2.427869858809085,12.49690266857053
GO:2000649,Regulation Of Sodium Ion Transmembrane Transporter Activity,0.0058152563843103,2.427869858809085,12.49690266857053
GO:0051168,Nuclear Export,0.0058868266158689,2.1502073414222087,11.041396839144332
GO:0032651,Regulation Of Interleukin-1 Beta Production,0.0058896931343353,1.7900261659227337,9.190981324250906
GO:0036261,7-Methylguanosine Cap Hypermethylation,0.0061302914905246,12.370290964777949,63.02060787026192
GO:0006983,ER Overload Response,0.0061302914905246,12.370290964777949,63.02060787026192
GO:0036260,RNA Capping,0.0061302914905246,12.370290964777949,63.02060787026192
GO:0086026,Atrial Cardiac Muscle Cell To AV Node Cell Signaling,0.0061302914905246,12.370290964777949,63.02060787026192
GO:0003230,Cardiac Atrium Development,0.0061302914905246,12.370290964777949,63.02060787026192
GO:0051937,Catecholamine Transport,0.0061302914905246,12.370290964777949,63.02060787026192
GO:0071732,Cellular Response To Nitric Oxide,0.0061302914905246,12.370290964777949,63.02060787026192
GO:0035865,Cellular Response To Potassium Ion,0.0061302914905246,12.370290964777949,63.02060787026192
GO:1902170,Cellular Response To Reactive Nitrogen Species,0.0061302914905246,12.370290964777949,63.02060787026192
GO:0009235,Cobalamin Metabolic Process,0.0061302914905246,12.370290964777949,63.02060787026192
GO:0017004,Cytochrome Complex Assembly,0.0061302914905246,12.370290964777949,63.02060787026192
GO:0090494,Dopamine Uptake,0.0061302914905246,12.370290964777949,63.02060787026192
GO:0051683,Establishment Of Golgi Localization,0.0061302914905246,12.370290964777949,63.02060787026192
GO:0001736,Establishment Of Planar Polarity,0.0061302914905246,12.370290964777949,63.02060787026192
GO:0008211,Glucocorticoid Metabolic Process,0.0061302914905246,12.370290964777949,63.02060787026192
GO:0051454,Intracellular pH Elevation,0.0061302914905246,12.370290964777949,63.02060787026192
GO:0072073,Kidney Epithelium Development,0.0061302914905246,12.370290964777949,63.02060787026192
GO:0070486,Leukocyte Aggregation,0.0061302914905246,12.370290964777949,63.02060787026192
GO:0003174,Mitral Valve Development,0.0061302914905246,12.370290964777949,63.02060787026192
GO:1903251,Multi-Ciliated Epithelial Cell Differentiation,0.0061302914905246,12.370290964777949,63.02060787026192
GO:0001779,Natural Killer Cell Differentiation,0.0061302914905246,12.370290964777949,63.02060787026192
GO:2000104,Negative Regulation Of DNA-templated DNA Replication,0.0061302914905246,12.370290964777949,63.02060787026192
GO:0034351,Negative Regulation Of Glial Cell Apoptotic Process,0.0061302914905246,12.370290964777949,63.02060787026192
GO:0090219,Negative Regulation Of Lipid Kinase Activity,0.0061302914905246,12.370290964777949,63.02060787026192
GO:2000178,Negative Regulation Of Neural Precursor Cell Proliferation,0.0061302914905246,12.370290964777949,63.02060787026192
GO:0060563,Neuroepithelial Cell Differentiation,0.0061302914905246,12.370290964777949,63.02060787026192
GO:1990700,Nucleolar Chromatin Organization,0.0061302914905246,12.370290964777949,63.02060787026192
GO:0120255,Olefinic Compound Biosynthetic Process,0.0061302914905246,12.370290964777949,63.02060787026192
GO:0034983,Peptidyl-Lysine Deacetylation,0.0061302914905246,12.370290964777949,63.02060787026192
GO:0062043,Positive Regulation Of Cardiac Epithelial To Mesenchymal Transition,0.0061302914905246,12.370290964777949,63.02060787026192
GO:0038089,Positive Regulation Of Cell Migration By Vascular Endothelial Growth Factor Signaling Pathway,0.0061302914905246,12.370290964777949,63.02060787026192
GO:1900119,Positive Regulation Of Execution Phase Of Apoptosis,0.0061302914905246,12.370290964777949,63.02060787026192
GO:0043568,Positive Regulation Of Insulin-Like Growth Factor Receptor Signaling Pathway,0.0061302914905246,12.370290964777949,63.02060787026192
GO:0150012,Positive Regulation Of Neuron Projection Arborization,0.0061302914905246,12.370290964777949,63.02060787026192
GO:0061365,Positive Regulation Of Triglyceride Lipase Activity,0.0061302914905246,12.370290964777949,63.02060787026192
GO:0031204,"Post-Translational Protein Targeting To Membrane, Translocation",0.0061302914905246,12.370290964777949,63.02060787026192
GO:1904491,Protein Localization To Ciliary Transition Zone,0.0061302914905246,12.370290964777949,63.02060787026192
GO:1903608,Protein Localization To Cytoplasmic Stress Granule,0.0061302914905246,12.370290964777949,63.02060787026192
GO:1904714,Regulation Of Chaperone-Mediated Autophagy,0.0061302914905246,12.370290964777949,63.02060787026192
GO:0042053,Regulation Of Dopamine Metabolic Process,0.0061302914905246,12.370290964777949,63.02060787026192
GO:0051584,Regulation Of Dopamine Uptake Involved In Synaptic Transmission,0.0061302914905246,12.370290964777949,63.02060787026192
GO:1903747,Regulation Of Establishment Of Protein Localization To Mitochondrion,0.0061302914905246,12.370290964777949,63.02060787026192
GO:0070228,Regulation Of Lymphocyte Apoptotic Process,0.0061302914905246,12.370290964777949,63.02060787026192
GO:2000739,Regulation Of Mesenchymal Stem Cell Differentiation,0.0061302914905246,12.370290964777949,63.02060787026192
GO:1903201,Regulation Of Oxidative Stress-Induced Cell Death,0.0061302914905246,12.370290964777949,63.02060787026192
GO:1901388,Regulation Of Transforming Growth Factor Beta Activation,0.0061302914905246,12.370290964777949,63.02060787026192
GO:0035864,Response To Potassium Ion,0.0061302914905246,12.370290964777949,63.02060787026192
GO:0030422,siRNA Processing,0.0061302914905246,12.370290964777949,63.02060787026192
GO:0000012,Single Strand Break Repair,0.0061302914905246,12.370290964777949,63.02060787026192
GO:0048536,Spleen Development,0.0061302914905246,12.370290964777949,63.02060787026192
GO:0030878,Thyroid Gland Development,0.0061302914905246,12.370290964777949,63.02060787026192
GO:0034505,Tooth Mineralization,0.0061302914905246,12.370290964777949,63.02060787026192
GO:0003222,Ventricular Trabecula Myocardium Morphogenesis,0.0061302914905246,12.370290964777949,63.02060787026192
GO:0071542,Dopaminergic Neuron Differentiation,0.006189144003503,3.5360427432775685,17.98063056434034
GO:0061436,Establishment Of Skin Barrier,0.006189144003503,3.5360427432775685,17.98063056434034
GO:0070498,Interleukin-1-Mediated Signaling Pathway,0.006189144003503,3.5360427432775685,17.98063056434034
GO:0007498,Mesoderm Development,0.006189144003503,3.5360427432775685,17.98063056434034
GO:0050795,Regulation Of Behavior,0.006189144003503,3.5360427432775685,17.98063056434034
GO:0046599,Regulation Of Centriole Replication,0.006189144003503,3.5360427432775685,17.98063056434034
GO:0070542,Response To Fatty Acid,0.006189144003503,3.5360427432775685,17.98063056434034
GO:0006399,tRNA Metabolic Process,0.006189144003503,3.5360427432775685,17.98063056434034
GO:0006909,Phagocytosis,0.006241504735663,1.8928186990619715,9.608958447809568
GO:0052548,Regulation Of Endopeptidase Activity,0.006241504735663,1.8928186990619715,9.608958447809568
GO:0006487,Protein N-linked Glycosylation,0.0062692287447584,1.9395849346656415,9.837772508203358
GO:0043124,Negative Regulation Of I-kappaB kinase/NF-kappaB Signaling,0.0064001611995788,2.270248695118207,11.468007136907495
GO:0032649,Regulation Of Type II Interferon Production,0.0065483109460579,1.7578084058274814,8.839224178034154
GO:0002244,Hematopoietic Progenitor Cell Differentiation,0.0065559022638583,2.750920245398773,13.829947628865066
GO:0023057,Negative Regulation Of Signaling,0.0065559022638583,2.750920245398773,13.829947628865066
GO:0002230,Positive Regulation Of Defense Response To Virus By Host,0.0065559022638583,2.750920245398773,13.829947628865066
GO:0010906,Regulation Of Glucose Metabolic Process,0.0065559022638583,2.750920245398773,13.829947628865066
GO:0043269,Regulation Of Monoatomic Ion Transport,0.0065559022638583,2.750920245398773,13.829947628865066
GO:1902305,Regulation Of Sodium Ion Transmembrane Transport,0.0065559022638583,2.750920245398773,13.829947628865066
GO:0006368,Transcription Elongation By RNA Polymerase II,0.0065559022638583,2.750920245398773,13.829947628865066
GO:0048010,Vascular Endothelial Growth Factor Receptor Signaling Pathway,0.0065559022638583,2.750920245398773,13.829947628865066
GO:0006607,NLS-bearing Protein Import Into Nucleus,0.0067523323181101,3.781302681992337,18.89844904528134
GO:0042982,Amyloid Precursor Protein Metabolic Process,0.0067523323181101,3.781302681992337,18.89844904528134
GO:0034620,Cellular Response To Unfolded Protein,0.0067523323181101,3.781302681992337,18.89844904528134
GO:0021954,Central Nervous System Neuron Development,0.0067523323181101,3.781302681992337,18.89844904528134
GO:0035050,Embryonic Heart Tube Development,0.0067523323181101,3.781302681992337,18.89844904528134
GO:0060485,Mesenchyme Development,0.0067523323181101,3.781302681992337,18.89844904528134
GO:0060415,Muscle Tissue Morphogenesis,0.0067523323181101,3.781302681992337,18.89844904528134
GO:0002275,Myeloid Cell Activation Involved In Immune Response,0.0067523323181101,3.781302681992337,18.89844904528134
GO:0048147,Negative Regulation Of Fibroblast Proliferation,0.0067523323181101,3.781302681992337,18.89844904528134
GO:1904706,Negative Regulation Of Vascular Associated Smooth Muscle Cell Proliferation,0.0067523323181101,3.781302681992337,18.89844904528134
GO:0050775,Positive Regulation Of Dendrite Morphogenesis,0.0067523323181101,3.781302681992337,18.89844904528134
GO:0070665,Positive Regulation Of Leukocyte Proliferation,0.0067523323181101,3.781302681992337,18.89844904528134
GO:0010744,Positive Regulation Of Macrophage Derived Foam Cell Differentiation,0.0067523323181101,3.781302681992337,18.89844904528134
GO:0051000,Positive Regulation Of Nitric-Oxide Synthase Activity,0.0067523323181101,3.781302681992337,18.89844904528134
GO:0001516,Prostaglandin Biosynthetic Process,0.0067523323181101,3.781302681992337,18.89844904528134
GO:0000154,rRNA Modification,0.0067523323181101,3.781302681992337,18.89844904528134
GO:0001919,Regulation Of Receptor Recycling,0.0067523323181101,3.781302681992337,18.89844904528134
GO:1904666,Regulation Of Ubiquitin Protein Ligase Activity,0.0067523323181101,3.781302681992337,18.89844904528134
GO:0000096,Sulfur Amino Acid Metabolic Process,0.0067523323181101,3.781302681992337,18.89844904528134
GO:0050890,Cognition,0.0068063350751077,2.153776305950219,10.74713155899849
GO:0051346,Negative Regulation Of Hydrolase Activity,0.0068063350751077,2.153776305950219,10.74713155899849
GO:0046474,Glycerophospholipid Biosynthetic Process,0.0069125845533884,1.652774352651048,8.221580044650894
GO:2000181,Negative Regulation Of Blood Vessel Morphogenesis,0.0069411882796651,1.8132382739212007,9.012306093596496
GO:0006474,N-terminal Protein Amino Acid Acetylation,0.0072529780252247,4.124731841863316,20.319844381970324
GO:0050435,Amyloid-Beta Metabolic Process,0.0072529780252247,4.124731841863316,20.319844381970324
GO:0014002,Astrocyte Development,0.0072529780252247,4.124731841863316,20.319844381970324
GO:0055003,Cardiac Myofibril Assembly,0.0072529780252247,4.124731841863316,20.319844381970324
GO:0090505,Epiboly Involved In Wound Healing,0.0072529780252247,4.124731841863316,20.319844381970324
GO:0009065,Glutamine Family Amino Acid Catabolic Process,0.0072529780252247,4.124731841863316,20.319844381970324
GO:0086011,Membrane Repolarization During Action Potential,0.0072529780252247,4.124731841863316,20.319844381970324
GO:0010544,Negative Regulation Of Platelet Activation,0.0072529780252247,4.124731841863316,20.319844381970324
GO:0043517,"Positive Regulation Of DNA Damage Response, Signal Transduction By P53 Class Mediator",0.0072529780252247,4.124731841863316,20.319844381970324
GO:0050867,Positive Regulation Of Cell Activation,0.0072529780252247,4.124731841863316,20.319844381970324
GO:0045830,Positive Regulation Of Isotype Switching,0.0072529780252247,4.124731841863316,20.319844381970324
GO:0099054,Presynapse Assembly,0.0072529780252247,4.124731841863316,20.319844381970324
GO:0150105,Protein Localization To Cell-Cell Junction,0.0072529780252247,4.124731841863316,20.319844381970324
GO:2000810,Regulation Of Bicellular Tight Junction Assembly,0.0072529780252247,4.124731841863316,20.319844381970324
GO:0006109,Regulation Of Carbohydrate Metabolic Process,0.0072529780252247,4.124731841863316,20.319844381970324
GO:0045191,Regulation Of Isotype Switching,0.0072529780252247,4.124731841863316,20.319844381970324
GO:0045655,Regulation Of Monocyte Differentiation,0.0072529780252247,4.124731841863316,20.319844381970324
GO:0001990,Regulation Of Systemic Arterial Blood Pressure By Hormone,0.0072529780252247,4.124731841863316,20.319844381970324
GO:0048485,Sympathetic Nervous System Development,0.0072529780252247,4.124731841863316,20.319844381970324
GO:0002097,tRNA Wobble Base Modification,0.0072529780252247,4.124731841863316,20.319844381970324
GO:0002098,tRNA Wobble Uridine Modification,0.0072529780252247,4.124731841863316,20.319844381970324
GO:1904903,ESCRT III Complex Disassembly,0.0073136444749299,7.216572216265891,35.49120008327282
GO:1904896,ESCRT Complex Disassembly,0.0073136444749299,7.216572216265891,35.49120008327282
GO:0046040,IMP Metabolic Process,0.0073136444749299,7.216572216265891,35.49120008327282
GO:0030242,Autophagy Of Peroxisome,0.0073136444749299,7.216572216265891,35.49120008327282
GO:0009437,Carnitine Metabolic Process,0.0073136444749299,7.216572216265891,35.49120008327282
GO:0072202,Cell Differentiation Involved In Metanephros Development,0.0073136444749299,7.216572216265891,35.49120008327282
GO:0001711,Endodermal Cell Fate Commitment,0.0073136444749299,7.216572216265891,35.49120008327282
GO:0061154,Endothelial Tube Morphogenesis,0.0073136444749299,7.216572216265891,35.49120008327282
GO:0035136,Forelimb Morphogenesis,0.0073136444749299,7.216572216265891,35.49120008327282
GO:0003183,Mitral Valve Morphogenesis,0.0073136444749299,7.216572216265891,35.49120008327282
GO:0042693,Muscle Cell Fate Commitment,0.0073136444749299,7.216572216265891,35.49120008327282
GO:0014812,Muscle Cell Migration,0.0073136444749299,7.216572216265891,35.49120008327282
GO:0034115,Negative Regulation Of Heterotypic Cell-Cell Adhesion,0.0073136444749299,7.216572216265891,35.49120008327282
GO:1905953,Negative Regulation Of Lipid Localization,0.0073136444749299,7.216572216265891,35.49120008327282
