GO,Term_Name_Clean,P-value,Z-score,Combined_Score
GO:1903320,Regulation Of Protein Modification By Small Protein Conjugation Or Removal,0.1169415257974839,1.675072819254944,3.594842367483563
GO:0048545,Response To Steroid Hormone,0.1169415257974839,1.675072819254944,3.594842367483563
GO:0010596,Negative Regulation Of Endothelial Cell Migration,0.1171754974827036,1.570902716914987,3.368145008114164
GO:0032273,Positive Regulation Of Protein Polymerization,0.119855165911342,1.3749231714812538,2.916859932358425
GO:0051222,Positive Regulation Of Protein Transport,0.119855165911342,1.3749231714812538,2.916859932358425
GO:0032970,Regulation Of Actin Filament-Based Process,0.119855165911342,1.3749231714812538,2.916859932358425
GO:0006968,Cellular Defense Response,0.1210492199199543,1.4728580198193455,3.110025193378428
GO:0015914,Phospholipid Transport,0.1214087250768769,1.414075114075114,2.9817082258682697
GO:1901991,Negative Regulation Of Mitotic Cell Cycle Phase Transition,0.1246938182271882,1.523953393758712,3.172709427786774
GO:1903531,Negative Regulation Of Secretion By Cell,0.1246938182271882,1.523953393758712,3.172709427786774
GO:0002763,Positive Regulation Of Myeloid Leukocyte Differentiation,0.1246938182271882,1.523953393758712,3.172709427786774
GO:0034204,Lipid Translocation,0.1248478764938463,1.7443088712054229,3.6293124241175696
GO:1901889,Negative Regulation Of Cell Junction Assembly,0.1248478764938463,1.7443088712054229,3.6293124241175696
GO:0032740,Positive Regulation Of Interleukin-17 Production,0.1248478764938463,1.7443088712054229,3.6293124241175696
GO:0043491,Protein Kinase B Signaling,0.1248478764938463,1.7443088712054229,3.6293124241175696
GO:1903050,Regulation Of Proteolysis Involved In Protein Catabolic Process,0.1248478764938463,1.7443088712054229,3.6293124241175696
GO:0006650,Glycerophospholipid Metabolic Process,0.1260104133423262,1.393380018015251,2.886234452505112
GO:0042886,Amide Transport,0.1265943693150892,1.603495860165593,3.314052723600858
GO:0007292,Female Gamete Generation,0.1265943693150892,1.603495860165593,3.314052723600858
GO:0000041,Transition Metal Ion Transport,0.1265943693150892,1.603495860165593,3.314052723600858
GO:0000038,Very Long-Chain Fatty Acid Metabolic Process,0.1265943693150892,1.603495860165593,3.314052723600858
GO:0016482,Cytosolic Transport,0.1281140022236024,1.2534923285832462,2.5757196195443983
GO:0061157,mRNA Destabilization,0.1316632005833943,1.4845167229211416,3.0098697215460244
GO:0030866,Cortical Actin Cytoskeleton Organization,0.1321110465119042,1.855155507890302,3.7550433576170894
GO:1903038,Negative Regulation Of Leukocyte Cell-Cell Adhesion,0.1321110465119042,1.855155507890302,3.7550433576170894
GO:0033137,Negative Regulation Of Peptidyl-Serine Phosphorylation,0.1321110465119042,1.855155507890302,3.7550433576170894
GO:0006817,Phosphate Ion Transport,0.1321110465119042,1.855155507890302,3.7550433576170894
GO:0006656,Phosphatidylcholine Biosynthetic Process,0.1321110465119042,1.855155507890302,3.7550433576170894
GO:0045773,Positive Regulation Of Axon Extension,0.1321110465119042,1.855155507890302,3.7550433576170894
GO:0070886,Positive Regulation Of calcineurin-NFAT Signaling Cascade,0.1321110465119042,1.855155507890302,3.7550433576170894
GO:0106058,Positive Regulation Of Calcineurin-Mediated Signaling,0.1321110465119042,1.855155507890302,3.7550433576170894
GO:0002673,Regulation Of Acute Inflammatory Response,0.1321110465119042,1.855155507890302,3.7550433576170894
GO:0040036,Regulation Of Fibroblast Growth Factor Receptor Signaling Pathway,0.1321110465119042,1.855155507890302,3.7550433576170894
GO:0043567,Regulation Of Insulin-Like Growth Factor Receptor Signaling Pathway,0.1321110465119042,1.855155507890302,3.7550433576170894
GO:0051783,Regulation Of Nuclear Division,0.1321110465119042,1.855155507890302,3.7550433576170894
GO:0014910,Regulation Of Smooth Muscle Cell Migration,0.1321110465119042,1.855155507890302,3.7550433576170894
GO:0007029,Endoplasmic Reticulum Organization,0.1321830929962317,1.4176389315320848,2.868687713227608
GO:1902905,Positive Regulation Of Supramolecular Fiber Organization,0.132251732040707,1.2935106052821683,2.616834187367956
GO:0043087,Regulation Of GTPase Activity,0.1341890633212571,1.1836481882935894,2.3773639591472127
GO:0035493,SNARE Complex Assembly,0.1349539755586119,2.576175164599602,5.159618957084598
GO:0070252,Actin-Mediated Cell Contraction,0.1349539755586119,2.576175164599602,5.159618957084598
GO:0006022,Aminoglycan Metabolic Process,0.1349539755586119,2.576175164599602,5.159618957084598
GO:0031103,Axon Regeneration,0.1349539755586119,2.576175164599602,5.159618957084598
GO:0031214,Biomineral Tissue Development,0.1349539755586119,2.576175164599602,5.159618957084598
GO:0006182,cGMP Biosynthetic Process,0.1349539755586119,2.576175164599602,5.159618957084598
GO:0060402,Calcium Ion Transport Into Cytosol,0.1349539755586119,2.576175164599602,5.159618957084598
GO:0046835,Carbohydrate Phosphorylation,0.1349539755586119,2.576175164599602,5.159618957084598
GO:0071379,Cellular Response To Prostaglandin Stimulus,0.1349539755586119,2.576175164599602,5.159618957084598
GO:0071415,Cellular Response To Purine-Containing Compound,0.1349539755586119,2.576175164599602,5.159618957084598
GO:0050654,Chondroitin Sulfate Proteoglycan Metabolic Process,0.1349539755586119,2.576175164599602,5.159618957084598
GO:0060287,Epithelial Cilium Movement Involved In Determination Of Left/Right Asymmetry,0.1349539755586119,2.576175164599602,5.159618957084598
GO:0008611,Ether Lipid Biosynthetic Process,0.1349539755586119,2.576175164599602,5.159618957084598
GO:1904861,Excitatory Synapse Assembly,0.1349539755586119,2.576175164599602,5.159618957084598
GO:0097530,Granulocyte Migration,0.1349539755586119,2.576175164599602,5.159618957084598
GO:0034755,Iron Ion Transmembrane Transport,0.1349539755586119,2.576175164599602,5.159618957084598
GO:0060428,Lung Epithelium Development,0.1349539755586119,2.576175164599602,5.159618957084598
GO:0101024,Mitotic Nuclear Membrane Organization,0.1349539755586119,2.576175164599602,5.159618957084598
GO:0007084,Mitotic Nuclear Membrane Reassembly,0.1349539755586119,2.576175164599602,5.159618957084598
GO:0002011,Morphogenesis Of An Epithelial Sheet,0.1349539755586119,2.576175164599602,5.159618957084598
GO:0032288,Myelin Assembly,0.1349539755586119,2.576175164599602,5.159618957084598
GO:0043217,Myelin Maintenance,0.1349539755586119,2.576175164599602,5.159618957084598
GO:0070266,Necroptotic Process,0.1349539755586119,2.576175164599602,5.159618957084598
GO:2000048,Negative Regulation Of Cell-Cell Adhesion Mediated By Cadherin,0.1349539755586119,2.576175164599602,5.159618957084598
GO:1902260,Negative Regulation Of Delayed Rectifier Potassium Channel Activity,0.1349539755586119,2.576175164599602,5.159618957084598
GO:1904950,Negative Regulation Of Establishment Of Protein Localization,0.1349539755586119,2.576175164599602,5.159618957084598
GO:0070229,Negative Regulation Of Lymphocyte Apoptotic Process,0.1349539755586119,2.576175164599602,5.159618957084598
GO:0010656,Negative Regulation Of Muscle Cell Apoptotic Process,0.1349539755586119,2.576175164599602,5.159618957084598
GO:0060546,Negative Regulation Of Necroptotic Process,0.1349539755586119,2.576175164599602,5.159618957084598
GO:2000009,Negative Regulation Of Protein Localization To Cell Surface,0.1349539755586119,2.576175164599602,5.159618957084598
GO:0034144,Negative Regulation Of Toll-Like Receptor 4 Signaling Pathway,0.1349539755586119,2.576175164599602,5.159618957084598
GO:0071635,Negative Regulation Of Transforming Growth Factor Beta Production,0.1349539755586119,2.576175164599602,5.159618957084598
GO:0009116,Nucleoside Metabolic Process,0.1349539755586119,2.576175164599602,5.159618957084598
GO:0006591,Ornithine Metabolic Process,0.1349539755586119,2.576175164599602,5.159618957084598
GO:0006907,Pinocytosis,0.1349539755586119,2.576175164599602,5.159618957084598
GO:1903580,Positive Regulation Of ATP Metabolic Process,0.1349539755586119,2.576175164599602,5.159618957084598
GO:0070234,Positive Regulation Of T Cell Apoptotic Process,0.1349539755586119,2.576175164599602,5.159618957084598
GO:1905209,Positive Regulation Of Cardiocyte Differentiation,0.1349539755586119,2.576175164599602,5.159618957084598
GO:0045657,Positive Regulation Of Monocyte Differentiation,0.1349539755586119,2.576175164599602,5.159618957084598
GO:0048643,Positive Regulation Of Skeletal Muscle Tissue Development,0.1349539755586119,2.576175164599602,5.159618957084598
GO:1902307,Positive Regulation Of Sodium Ion Transmembrane Transport,0.1349539755586119,2.576175164599602,5.159618957084598
GO:1901838,Positive Regulation Of Transcription Of Nucleolar Large rRNA By RNA Polymerase I,0.1349539755586119,2.576175164599602,5.159618957084598
GO:0035372,Protein Localization To Microtubule,0.1349539755586119,2.576175164599602,5.159618957084598
GO:0072698,Protein Localization To Microtubule Cytoskeleton,0.1349539755586119,2.576175164599602,5.159618957084598
GO:0030832,Regulation Of Actin Filament Length,0.1349539755586119,2.576175164599602,5.159618957084598
GO:2000303,Regulation Of Ceramide Biosynthetic Process,0.1349539755586119,2.576175164599602,5.159618957084598
GO:1903659,Regulation Of Complement-Dependent Cytotoxicity,0.1349539755586119,2.576175164599602,5.159618957084598
GO:0030852,Regulation Of Granulocyte Differentiation,0.1349539755586119,2.576175164599602,5.159618957084598
GO:0042634,Regulation Of Hair Cycle,0.1349539755586119,2.576175164599602,5.159618957084598
GO:0001910,Regulation Of Leukocyte Mediated Cytotoxicity,0.1349539755586119,2.576175164599602,5.159618957084598
GO:1900452,Regulation Of Long-Term Synaptic Depression,0.1349539755586119,2.576175164599602,5.159618957084598
GO:1903059,Regulation Of Protein Lipidation,0.1349539755586119,2.576175164599602,5.159618957084598
GO:1902947,Regulation Of Tau-Protein Kinase Activity,0.1349539755586119,2.576175164599602,5.159618957084598
GO:0070670,Response To Interleukin-4,0.1349539755586119,2.576175164599602,5.159618957084598
GO:0035581,Sequestering Of Extracellular Ligand From Receptor,0.1349539755586119,2.576175164599602,5.159618957084598
GO:0031629,Synaptic Vesicle Fusion To Presynaptic Active Zone Membrane,0.1349539755586119,2.576175164599602,5.159618957084598
GO:1901998,Toxin Transport,0.1349539755586119,2.576175164599602,5.159618957084598
GO:1900026,Positive Regulation Of Substrate Adhesion-Dependent Cell Spreading,0.1353848538710381,1.546235239993866,3.091904228333953
GO:0070918,Regulatory ncRNA Processing,0.1353848538710381,1.546235239993866,3.091904228333953
GO:0007202,Activation Of Phospholipase C Activity,0.1366016212445998,1.6491722869405272,3.2829849473625683
GO:0050433,Regulation Of Catecholamine Secretion,0.1366016212445998,1.6491722869405272,3.2829849473625683
GO:0090502,"RNA Phosphodiester Bond Hydrolysis, Endonucleolytic",0.137089801857794,2.061111962015622,4.095674905488807
GO:0042098,T Cell Proliferation,0.137089801857794,2.061111962015622,4.095674905488807
GO:0006026,Aminoglycan Catabolic Process,0.137089801857794,2.061111962015622,4.095674905488807
GO:0071360,Cellular Response To Exogenous dsRNA,0.137089801857794,2.061111962015622,4.095674905488807
GO:0034508,Centromere Complex Assembly,0.137089801857794,2.061111962015622,4.095674905488807
GO:0022900,Electron Transport Chain,0.137089801857794,2.061111962015622,4.095674905488807
GO:0070199,Establishment Of Protein Localization To Chromosome,0.137089801857794,2.061111962015622,4.095674905488807
GO:0051293,Establishment Of Spindle Localization,0.137089801857794,2.061111962015622,4.095674905488807
GO:0006851,Mitochondrial Calcium Ion Transmembrane Transport,0.137089801857794,2.061111962015622,4.095674905488807
GO:0045776,Negative Regulation Of Blood Pressure,0.137089801857794,2.061111962015622,4.095674905488807
GO:0045869,Negative Regulation Of Single Stranded Viral RNA Replication Via Double Stranded DNA Intermediate,0.137089801857794,2.061111962015622,4.095674905488807
GO:2000678,Negative Regulation Of Transcription Regulatory Region DNA Binding,0.137089801857794,2.061111962015622,4.095674905488807
GO:0001845,Phagolysosome Assembly,0.137089801857794,2.061111962015622,4.095674905488807
GO:0002675,Positive Regulation Of Acute Inflammatory Response,0.137089801857794,2.061111962015622,4.095674905488807
GO:1900273,Positive Regulation Of Long-Term Synaptic Potentiation,0.137089801857794,2.061111962015622,4.095674905488807
GO:0043243,Positive Regulation Of Protein-Containing Complex Disassembly,0.137089801857794,2.061111962015622,4.095674905488807
GO:0070207,Protein Homotrimerization,0.137089801857794,2.061111962015622,4.095674905488807
GO:0070206,Protein Trimerization,0.137089801857794,2.061111962015622,4.095674905488807
GO:0046850,Regulation Of Bone Remodeling,0.137089801857794,2.061111962015622,4.095674905488807
GO:0060259,Regulation Of Feeding Behavior,0.137089801857794,2.061111962015622,4.095674905488807
GO:1903978,Regulation Of Microglial Cell Activation,0.137089801857794,2.061111962015622,4.095674905488807
GO:2000050,Regulation Of Non-Canonical Wnt Signaling Pathway,0.137089801857794,2.061111962015622,4.095674905488807
GO:0060211,Regulation Of Nuclear-Transcribed mRNA poly(A) Tail Shortening,0.137089801857794,2.061111962015622,4.095674905488807
GO:0006939,Smooth Muscle Contraction,0.137089801857794,2.061111962015622,4.095674905488807
GO:0016071,mRNA Metabolic Process,0.137364560441238,1.308851535977478,2.598223254308792
GO:0006865,Amino Acid Transport,0.1381375576325711,1.4509232264334304,2.872110210605009
GO:0042058,Regulation Of Epidermal Growth Factor Receptor Signaling Pathway,0.1381375576325711,1.4509232264334304,2.872110210605009
GO:0090288,Negative Regulation Of Cellular Response To Growth Factor Stimulus,0.1384795670814197,1.3428481582596017,2.6548544438390635
GO:1902904,Negative Regulation Of Supramolecular Fiber Organization,0.1384795670814197,1.3428481582596017,2.6548544438390635
GO:0043488,Regulation Of mRNA Stability,0.1422395603234498,1.3289995389580451,2.5918715140112303
GO:0050772,Positive Regulation Of Axonogenesis,0.1434172152702521,1.4993865030674849,2.91180455159353
GO:1904659,Glucose Transmembrane Transport,0.1469633397546812,1.7177444069874348,3.2938987716371253
GO:0045143,Homologous Chromosome Segregation,0.1469633397546812,1.7177444069874348,3.2938987716371253
GO:0033617,Mitochondrial Cytochrome C Oxidase Assembly,0.1469633397546812,1.7177444069874348,3.2938987716371253
GO:0070129,Regulation Of Mitochondrial Translation,0.1469633397546812,1.7177444069874348,3.2938987716371253
GO:0071675,Regulation Of Mononuclear Cell Migration,0.1469633397546812,1.7177444069874348,3.2938987716371253
GO:0032692,Negative Regulation Of Interleukin-1 Production,0.1470802025471798,1.5764218917675916,3.021649611333887
GO:0090304,Nucleic Acid Metabolic Process,0.1470802025471798,1.5764218917675916,3.021649611333887
GO:1903955,Positive Regulation Of Protein Targeting To Mitochondrion,0.1470802025471798,1.5764218917675916,3.021649611333887
GO:0061001,Regulation Of Dendritic Spine Morphogenesis,0.1470802025471798,1.5764218917675916,3.021649611333887
GO:0002833,Positive Regulation Of Response To Biotic Stimulus,0.1507816259132428,1.4603466789384876,2.7628629951110666
GO:0010951,Negative Regulation Of Endopeptidase Activity,0.1508414799925544,1.340337941628264,2.535283790564774
GO:0002720,Positive Regulation Of Cytokine Production Involved In Immune Response,0.1564746446267662,1.5189883632724863,2.8175127260714152
GO:0070536,Protein K63-linked Deubiquitination,0.1564746446267662,1.5189883632724863,2.8175127260714152
GO:0006896,Golgi To Vacuole Transport,0.1570189583727321,1.8321078431372548,3.391943807354835
GO:1901264,Carbohydrate Derivative Transport,0.1570189583727321,1.8321078431372548,3.391943807354835
GO:0035329,Hippo Signaling,0.1570189583727321,1.8321078431372548,3.391943807354835
GO:0035338,Long-Chain fatty-acyl-CoA Biosynthetic Process,0.1570189583727321,1.8321078431372548,3.391943807354835
GO:0050918,Positive Chemotaxis,0.1570189583727321,1.8321078431372548,3.391943807354835
GO:0045591,Positive Regulation Of Regulatory T Cell Differentiation,0.1570189583727321,1.8321078431372548,3.391943807354835
GO:0001941,Postsynaptic Membrane Organization,0.1570189583727321,1.8321078431372548,3.391943807354835
GO:0071539,Protein Localization To Centrosome,0.1570189583727321,1.8321078431372548,3.391943807354835
GO:0072522,Purine-Containing Compound Biosynthetic Process,0.1570189583727321,1.8321078431372548,3.391943807354835
GO:0090266,Regulation Of Mitotic Cell Cycle Spindle Assembly Checkpoint,0.1570189583727321,1.8321078431372548,3.391943807354835
GO:0006612,Protein Targeting To Membrane,0.1587184933307469,1.3122311001843885,2.4153229124304576
GO:0043631,RNA Polyadenylation,0.1598083511274359,1.619594964422551,2.969980833037513
GO:1904262,Negative Regulation Of TORC1 Signaling,0.1598083511274359,1.619594964422551,2.969980833037513
GO:1902230,Negative Regulation Of Intrinsic Apoptotic Signaling Pathway In Response To DNA Damage,0.1598083511274359,1.619594964422551,2.969980833037513
GO:0051497,Negative Regulation Of Stress Fiber Assembly,0.1598083511274359,1.619594964422551,2.969980833037513
GO:2000406,Positive Regulation Of T Cell Migration,0.1598083511274359,1.619594964422551,2.969980833037513
GO:0046326,Positive Regulation Of Glucose Import,0.1598083511274359,1.619594964422551,2.969980833037513
GO:0035330,Regulation Of Hippo Signaling,0.1598083511274359,1.619594964422551,2.969980833037513
GO:0099175,Regulation Of Postsynapse Organization,0.1598083511274359,1.619594964422551,2.969980833037513
GO:0070613,Regulation Of Protein Processing,0.1598083511274359,1.619594964422551,2.969980833037513
GO:0015866,ADP Transport,0.1633684796820738,2.7477036129822414,4.978143827077341
GO:0035510,DNA Dealkylation,0.1633684796820738,2.7477036129822414,4.978143827077341
GO:0006307,DNA Dealkylation Involved In DNA Repair,0.1633684796820738,2.7477036129822414,4.978143827077341
GO:0015808,L-alanine Transport,0.1633684796820738,2.7477036129822414,4.978143827077341
GO:0017196,N-terminal Peptidyl-Methionine Acetylation,0.1633684796820738,2.7477036129822414,4.978143827077341
GO:0070231,T Cell Apoptotic Process,0.1633684796820738,2.7477036129822414,4.978143827077341
GO:0035666,TRIF-dependent Toll-Like Receptor Signaling Pathway,0.1633684796820738,2.7477036129822414,4.978143827077341
GO:0046185,Aldehyde Catabolic Process,0.1633684796820738,2.7477036129822414,4.978143827077341
GO:0019400,Alditol Metabolic Process,0.1633684796820738,2.7477036129822414,4.978143827077341
GO:0099641,Anterograde Axonal Protein Transport,0.1633684796820738,2.7477036129822414,4.978143827077341
GO:0009067,Aspartate Family Amino Acid Biosynthetic Process,0.1633684796820738,2.7477036129822414,4.978143827077341
GO:0099640,Axo-Dendritic Protein Transport,0.1633684796820738,2.7477036129822414,4.978143827077341
GO:0032291,Axon Ensheathment In Central Nervous System,0.1633684796820738,2.7477036129822414,4.978143827077341
GO:0042424,Catecholamine Catabolic Process,0.1633684796820738,2.7477036129822414,4.978143827077341
GO:0042398,Cellular Modified Amino Acid Biosynthetic Process,0.1633684796820738,2.7477036129822414,4.978143827077341
GO:0060976,Coronary Vasculature Development,0.1633684796820738,2.7477036129822414,4.978143827077341
GO:0060977,Coronary Vasculature Morphogenesis,0.1633684796820738,2.7477036129822414,4.978143827077341
GO:0070729,Cyclic Nucleotide Transport,0.1633684796820738,2.7477036129822414,4.978143827077341
GO:0045008,Depyrimidination,0.1633684796820738,2.7477036129822414,4.978143827077341
GO:0042420,Dopamine Catabolic Process,0.1633684796820738,2.7477036129822414,4.978143827077341
GO:0000447,"Endonucleolytic Cleavage In ITS1 To Separate SSU-rRNA From 5.8S rRNA And LSU-rRNA From Tricistronic rRNA Transcript (SSU-rRNA, 5.8S rRNA, LSU-rRNA)",0.1633684796820738,2.7477036129822414,4.978143827077341
GO:0051660,Establishment Of Centrosome Localization,0.1633684796820738,2.7477036129822414,4.978143827077341
GO:0090077,Foam Cell Differentiation,0.1633684796820738,2.7477036129822414,4.978143827077341
GO:0006544,Glycine Metabolic Process,0.1633684796820738,2.7477036129822414,4.978143827077341
GO:0070537,Histone H2A K63-linked Deubiquitination,0.1633684796820738,2.7477036129822414,4.978143827077341
GO:0001771,Immunological Synapse Formation,0.1633684796820738,2.7477036129822414,4.978143827077341
GO:0006089,Lactate Metabolic Process,0.1633684796820738,2.7477036129822414,4.978143827077341
GO:0044805,Late Nucleophagy,0.1633684796820738,2.7477036129822414,4.978143827077341
GO:0070307,Lens Fiber Cell Development,0.1633684796820738,2.7477036129822414,4.978143827077341
GO:0006108,Malate Metabolic Process,0.1633684796820738,2.7477036129822414,4.978143827077341
GO:0070900,Mitochondrial tRNA Modification,0.1633684796820738,2.7477036129822414,4.978143827077341
GO:0032099,Negative Regulation Of Appetite,0.1633684796820738,2.7477036129822414,4.978143827077341
GO:2000480,Negative Regulation Of cAMP-dependent Protein Kinase Activity,0.1633684796820738,2.7477036129822414,4.978143827077341
GO:0046322,Negative Regulation Of Fatty Acid Oxidation,0.1633684796820738,2.7477036129822414,4.978143827077341
GO:0010839,Negative Regulation Of Keratinocyte Proliferation,0.1633684796820738,2.7477036129822414,4.978143827077341
GO:0070664,Negative Regulation Of Leukocyte Proliferation,0.1633684796820738,2.7477036129822414,4.978143827077341
GO:0002076,Osteoblast Development,0.1633684796820738,2.7477036129822414,4.978143827077341
GO:0060039,Pericardium Development,0.1633684796820738,2.7477036129822414,4.978143827077341
GO:1905920,Positive Regulation Of CoA-transferase Activity,0.1633684796820738,2.7477036129822414,4.978143827077341
GO:0048711,Positive Regulation Of Astrocyte Differentiation,0.1633684796820738,2.7477036129822414,4.978143827077341
GO:1902425,Positive Regulation Of Attachment Of Mitotic Spindle Microtubules To Kinetochore,0.1633684796820738,2.7477036129822414,4.978143827077341
GO:1905278,Positive Regulation Of Epithelial Tube Formation,0.1633684796820738,2.7477036129822414,4.978143827077341
GO:0010763,Positive Regulation Of Fibroblast Migration,0.1633684796820738,2.7477036129822414,4.978143827077341
GO:0010831,Positive Regulation Of Myotube Differentiation,0.1633684796820738,2.7477036129822414,4.978143827077341
GO:0010893,Positive Regulation Of Steroid Biosynthetic Process,0.1633684796820738,2.7477036129822414,4.978143827077341
GO:1904754,Positive Regulation Of Vascular Associated Smooth Muscle Cell Migration,0.1633684796820738,2.7477036129822414,4.978143827077341
GO:0097104,Postsynaptic Membrane Assembly,0.1633684796820738,2.7477036129822414,4.978143827077341
GO:0006517,Protein Deglycosylation,0.1633684796820738,2.7477036129822414,4.978143827077341
GO:1905383,Protein Localization To Presynapse,0.1633684796820738,2.7477036129822414,4.978143827077341
GO:1901894,Regulation Of ATPase-coupled Calcium Transmembrane Transporter Activity,0.1633684796820738,2.7477036129822414,4.978143827077341
GO:0032489,Regulation Of Cdc42 Protein Signal Transduction,0.1633684796820738,2.7477036129822414,4.978143827077341
GO:1905918,Regulation Of CoA-transferase Activity,0.1633684796820738,2.7477036129822414,4.978143827077341
GO:0042996,Regulation Of Golgi To Plasma Membrane Protein Transport,0.1633684796820738,2.7477036129822414,4.978143827077341
GO:0045628,Regulation Of T-helper 2 Cell Differentiation,0.1633684796820738,2.7477036129822414,4.978143827077341
GO:1902423,Regulation Of Attachment Of Mitotic Spindle Microtubules To Kinetochore,0.1633684796820738,2.7477036129822414,4.978143827077341
GO:1905005,Regulation Of Epithelial To Mesenchymal Transition Involved In Endocardial Cushion Formation,0.1633684796820738,2.7477036129822414,4.978143827077341
GO:0003330,Regulation Of Extracellular Matrix Constituent Secretion,0.1633684796820738,2.7477036129822414,4.978143827077341
GO:0031445,Regulation Of Heterochromatin Formation,0.1633684796820738,2.7477036129822414,4.978143827077341
GO:1903205,Regulation Of Hydrogen Peroxide-Induced Cell Death,0.1633684796820738,2.7477036129822414,4.978143827077341
GO:0050746,Regulation Of Lipoprotein Metabolic Process,0.1633684796820738,2.7477036129822414,4.978143827077341
GO:0080164,Regulation Of Nitric Oxide Metabolic Process,0.1633684796820738,2.7477036129822414,4.978143827077341
GO:0060049,Regulation Of Protein Glycosylation,0.1633684796820738,2.7477036129822414,4.978143827077341
GO:1903564,Regulation Of Protein Localization To Cilium,0.1633684796820738,2.7477036129822414,4.978143827077341
GO:1904749,Regulation Of Protein Localization To Nucleolus,0.1633684796820738,2.7477036129822414,4.978143827077341
GO:1903034,Regulation Of Response To Wounding,0.1633684796820738,2.7477036129822414,4.978143827077341
GO:0048742,Regulation Of Skeletal Muscle Fiber Development,0.1633684796820738,2.7477036129822414,4.978143827077341
GO:0033194,Response To Hydroperoxide,0.1633684796820738,2.7477036129822414,4.978143827077341
GO:0044341,Sodium-Dependent Phosphate Transport,0.1633684796820738,2.7477036129822414,4.978143827077341
GO:0008216,Spermidine Metabolic Process,0.1633684796820738,2.7477036129822414,4.978143827077341
GO:0090400,Stress-Induced Premature Senescence,0.1633684796820738,2.7477036129822414,4.978143827077341
GO:0019530,Taurine Metabolic Process,0.1633684796820738,2.7477036129822414,4.978143827077341
GO:0070327,Thyroid Hormone Transport,0.1633684796820738,2.7477036129822414,4.978143827077341
GO:0006568,Tryptophan Metabolic Process,0.1633684796820738,2.7477036129822414,4.978143827077341
GO:0070830,Bicellular Tight Junction Assembly,0.1638059042042048,1.3990004164931278,2.53089396861758
GO:0018410,C-terminal Protein Amino Acid Modification,0.1648267892917517,2.060949464012251,3.715603594572889
GO:0071103,DNA Conformation Change,0.1648267892917517,2.060949464012251,3.715603594572889
GO:0045006,DNA Deamination,0.1648267892917517,2.060949464012251,3.715603594572889
