GO,Term_Name_Clean,P-value,Z-score,Combined_Score
GO:0010884,Positive Regulation Of Lipid Storage,0.8338439203269117,0.6864186188945032,0.1247284682969134
GO:0050829,Defense Response To Gram-negative Bacterium,0.8386482561583459,0.8004604758250192,0.1408521488728785
GO:0006637,acyl-CoA Metabolic Process,0.8435121632557866,0.7161658141517476,0.1218777837067709
GO:0042267,Natural Killer Cell Mediated Cytotoxicity,0.8466239691578014,0.6863705972434916,0.1142797703166631
GO:0071108,Protein K48-linked Deubiquitination,0.8466239691578014,0.6863705972434916,0.1142797703166631
GO:2000311,Regulation Of AMPA Receptor Activity,0.8466239691578014,0.6863705972434916,0.1142797703166631
GO:0034356,NAD Biosynthesis Via Nicotinamide Riboside Salvage Pathway,0.8475866474128935,0.5884384975294066,0.0973054881163962
GO:0009308,Amine Metabolic Process,0.8475866474128935,0.5884384975294066,0.0973054881163962
GO:0046349,Amino Sugar Biosynthetic Process,0.8475866474128935,0.5884384975294066,0.0973054881163962
GO:0021515,Cell Differentiation In Spinal Cord,0.8475866474128935,0.5884384975294066,0.0973054881163962
GO:0046486,Glycerolipid Metabolic Process,0.8475866474128935,0.5884384975294066,0.0973054881163962
GO:0034453,Microtubule Anchoring,0.8475866474128935,0.5884384975294066,0.0973054881163962
GO:0033314,Mitotic DNA Replication Checkpoint Signaling,0.8475866474128935,0.5884384975294066,0.0973054881163962
GO:0046888,Negative Regulation Of Hormone Secretion,0.8475866474128935,0.5884384975294066,0.0973054881163962
GO:0016322,Neuron Remodeling,0.8475866474128935,0.5884384975294066,0.0973054881163962
GO:0018193,Peptidyl-Amino Acid Modification,0.8475866474128935,0.5884384975294066,0.0973054881163962
GO:0031442,Positive Regulation Of mRNA 3'-End Processing,0.8475866474128935,0.5884384975294066,0.0973054881163962
GO:0035871,Protein K11-linked Deubiquitination,0.8475866474128935,0.5884384975294066,0.0973054881163962
GO:2000668,Regulation Of Dendritic Cell Apoptotic Process,0.8475866474128935,0.5884384975294066,0.0973054881163962
GO:2001256,Regulation Of Store-Operated Calcium Entry,0.8475866474128935,0.5884384975294066,0.0973054881163962
GO:0007589,Body Fluid Secretion,0.8502287660716205,0.6178172355732435,0.1002407409199532
GO:0030201,Heparan Sulfate Proteoglycan Metabolic Process,0.8502287660716205,0.6178172355732435,0.1002407409199532
GO:0098781,ncRNA Transcription,0.8502287660716205,0.6178172355732435,0.1002407409199532
GO:0032897,Negative Regulation Of Viral Transcription,0.8502287660716205,0.6178172355732435,0.1002407409199532
GO:0007008,Outer Mitochondrial Membrane Organization,0.8502287660716205,0.6178172355732435,0.1002407409199532
GO:0032725,Positive Regulation Of Granulocyte Macrophage Colony-Stimulating Factor Production,0.8502287660716205,0.6178172355732435,0.1002407409199532
GO:0045040,Protein Insertion Into Mitochondrial Outer Membrane,0.8502287660716205,0.6178172355732435,0.1002407409199532
GO:0048172,Regulation Of Short-Term Neuronal Synaptic Plasticity,0.8502287660716205,0.6178172355732435,0.1002407409199532
GO:0044790,Suppression Of Viral Release By Host,0.8502287660716205,0.6178172355732435,0.1002407409199532
GO:0006644,Phospholipid Metabolic Process,0.8514638936797374,0.7821574344023323,0.1257694942508015
GO:0009792,Embryo Development Ending In Birth Or Egg Hatching,0.8574371633918664,0.6336143954025154,0.0974545710187939
GO:0042339,Keratan Sulfate Metabolic Process,0.8574371633918664,0.6336143954025154,0.0974545710187939
GO:0035970,Peptidyl-Threonine Dephosphorylation,0.8574371633918664,0.6336143954025154,0.0974545710187939
GO:0019751,Polyol Metabolic Process,0.8574371633918664,0.6336143954025154,0.0974545710187939
GO:0002385,Mucosal Immune Response,0.858399880163594,0.6863225608822178,0.1047913161888609
GO:0035609,C-terminal Protein Deglutamylation,0.8617650344015126,0.5149196633511859,0.0766059512045479
GO:0035710,"CD4-positive, Alpha-Beta T Cell Activation",0.8617650344015126,0.5149196633511859,0.0766059512045479
GO:0006335,DNA Replication-Dependent Chromatin Assembly,0.8617650344015126,0.5149196633511859,0.0766059512045479
GO:0032020,ISG15-protein Conjugation,0.8617650344015126,0.5149196633511859,0.0766059512045479
GO:0110154,RNA Decapping,0.8617650344015126,0.5149196633511859,0.0766059512045479
GO:0038203,TORC2 Signaling,0.8617650344015126,0.5149196633511859,0.0766059512045479
GO:0002191,Cap-Dependent Translational Initiation,0.8617650344015126,0.5149196633511859,0.0766059512045479
GO:0032490,Detection Of Molecule Of Bacterial Origin,0.8617650344015126,0.5149196633511859,0.0766059512045479
GO:0009597,Detection Of Virus,0.8617650344015126,0.5149196633511859,0.0766059512045479
GO:0001767,Establishment Of Lymphocyte Polarity,0.8617650344015126,0.5149196633511859,0.0766059512045479
GO:0019375,Galactolipid Biosynthetic Process,0.8617650344015126,0.5149196633511859,0.0766059512045479
GO:0006682,Galactosylceramide Biosynthetic Process,0.8617650344015126,0.5149196633511859,0.0766059512045479
GO:0000395,mRNA 5'-Splice Site Recognition,0.8617650344015126,0.5149196633511859,0.0766059512045479
GO:0036112,Medium-Chain fatty-acyl-CoA Metabolic Process,0.8617650344015126,0.5149196633511859,0.0766059512045479
GO:0035694,Mitochondrial Protein Catabolic Process,0.8617650344015126,0.5149196633511859,0.0766059512045479
GO:0072674,Multinuclear Osteoclast Differentiation,0.8617650344015126,0.5149196633511859,0.0766059512045479
GO:0034316,Negative Regulation Of Arp2/3 Complex-Mediated Actin Nucleation,0.8617650344015126,0.5149196633511859,0.0766059512045479
GO:1904293,Negative Regulation Of ERAD Pathway,0.8617650344015126,0.5149196633511859,0.0766059512045479
GO:0010667,Negative Regulation Of Cardiac Muscle Cell Apoptotic Process,0.8617650344015126,0.5149196633511859,0.0766059512045479
GO:0090027,Negative Regulation Of Monocyte Chemotaxis,0.8617650344015126,0.5149196633511859,0.0766059512045479
GO:2000623,"Negative Regulation Of Nuclear-Transcribed mRNA Catabolic Process, Nonsense-Mediated Decay",0.8617650344015126,0.5149196633511859,0.0766059512045479
GO:0015858,Nucleoside Transport,0.8617650344015126,0.5149196633511859,0.0766059512045479
GO:0017183,Peptidyl-Diphthamide Biosynthetic Process From Peptidyl-Histidine,0.8617650344015126,0.5149196633511859,0.0766059512045479
GO:0017182,Peptidyl-Diphthamide Metabolic Process,0.8617650344015126,0.5149196633511859,0.0766059512045479
GO:0090383,Phagosome Acidification,0.8617650344015126,0.5149196633511859,0.0766059512045479
GO:0036149,Phosphatidylinositol Acyl-Chain Remodeling,0.8617650344015126,0.5149196633511859,0.0766059512045479
GO:0030309,poly-N-acetyllactosamine Metabolic Process,0.8617650344015126,0.5149196633511859,0.0766059512045479
GO:2000096,"Positive Regulation Of Wnt Signaling Pathway, Planar Cell Polarity Pathway",0.8617650344015126,0.5149196633511859,0.0766059512045479
GO:0002579,Positive Regulation Of Antigen Processing And Presentation,0.8617650344015126,0.5149196633511859,0.0766059512045479
GO:0002606,Positive Regulation Of Dendritic Cell Antigen Processing And Presentation,0.8617650344015126,0.5149196633511859,0.0766059512045479
GO:1901552,Positive Regulation Of Endothelial Cell Development,0.8617650344015126,0.5149196633511859,0.0766059512045479
GO:1903142,Positive Regulation Of Establishment Of Endothelial Barrier,0.8617650344015126,0.5149196633511859,0.0766059512045479
GO:1903490,Positive Regulation Of Mitotic Cytokinesis,0.8617650344015126,0.5149196633511859,0.0766059512045479
GO:0033690,Positive Regulation Of Osteoblast Proliferation,0.8617650344015126,0.5149196633511859,0.0766059512045479
GO:1904184,Positive Regulation Of Pyruvate Dehydrogenase Activity,0.8617650344015126,0.5149196633511859,0.0766059512045479
GO:0034137,Positive Regulation Of Toll-Like Receptor 2 Signaling Pathway,0.8617650344015126,0.5149196633511859,0.0766059512045479
GO:0034157,Positive Regulation Of Toll-Like Receptor 7 Signaling Pathway,0.8617650344015126,0.5149196633511859,0.0766059512045479
GO:0042270,Protection From Natural Killer Cell Mediated Cytotoxicity,0.8617650344015126,0.5149196633511859,0.0766059512045479
GO:0018406,Protein C-linked Glycosylation Via 2'-alpha-mannosyl-L-tryptophan,0.8617650344015126,0.5149196633511859,0.0766059512045479
GO:0018317,Protein C-linked Glycosylation Via Tryptophan,0.8617650344015126,0.5149196633511859,0.0766059512045479
GO:1903044,Protein Localization To Membrane Raft,0.8617650344015126,0.5149196633511859,0.0766059512045479
GO:0070647,Protein Modification By Small Protein Conjugation Or Removal,0.8617650344015126,0.5149196633511859,0.0766059512045479
GO:0030091,Protein Repair,0.8617650344015126,0.5149196633511859,0.0766059512045479
GO:0070070,Proton-Transporting V-type ATPase Complex Assembly,0.8617650344015126,0.5149196633511859,0.0766059512045479
GO:1904823,Purine Nucleobase Transmembrane Transport,0.8617650344015126,0.5149196633511859,0.0766059512045479
GO:0072523,Purine-Containing Compound Catabolic Process,0.8617650344015126,0.5149196633511859,0.0766059512045479
GO:0015864,Pyrimidine Nucleoside Transport,0.8617650344015126,0.5149196633511859,0.0766059512045479
GO:0060019,Radial Glial Cell Differentiation,0.8617650344015126,0.5149196633511859,0.0766059512045479
GO:2001188,Regulation Of T Cell Activation Via T Cell Receptor Contact With Antigen Bound To MHC Molecule On Antigen Presenting Cell,0.8617650344015126,0.5149196633511859,0.0766059512045479
GO:2000328,Regulation Of T-helper 17 Cell Lineage Commitment,0.8617650344015126,0.5149196633511859,0.0766059512045479
GO:1903551,Regulation Of Extracellular Exosome Assembly,0.8617650344015126,0.5149196633511859,0.0766059512045479
GO:0003093,Regulation Of Glomerular Filtration,0.8617650344015126,0.5149196633511859,0.0766059512045479
GO:0046885,Regulation Of Hormone Biosynthetic Process,0.8617650344015126,0.5149196633511859,0.0766059512045479
GO:1902172,Regulation Of Keratinocyte Apoptotic Process,0.8617650344015126,0.5149196633511859,0.0766059512045479
GO:0060753,Regulation Of Mast Cell Chemotaxis,0.8617650344015126,0.5149196633511859,0.0766059512045479
GO:0002715,Regulation Of Natural Killer Cell Mediated Immunity,0.8617650344015126,0.5149196633511859,0.0766059512045479
GO:2000389,Regulation Of Neutrophil Extravasation,0.8617650344015126,0.5149196633511859,0.0766059512045479
GO:0090085,Regulation Of Protein Deubiquitination,0.8617650344015126,0.5149196633511859,0.0766059512045479
GO:1900003,Regulation Of Serine-Type Endopeptidase Activity,0.8617650344015126,0.5149196633511859,0.0766059512045479
GO:0007172,Signal Complex Assembly,0.8617650344015126,0.5149196633511859,0.0766059512045479
GO:0006686,Sphingomyelin Biosynthetic Process,0.8617650344015126,0.5149196633511859,0.0766059512045479
GO:0051031,tRNA Transport,0.8617650344015126,0.5149196633511859,0.0766059512045479
GO:0044342,Type B Pancreatic Cell Proliferation,0.8617650344015126,0.5149196633511859,0.0766059512045479
GO:0015862,Uridine Transport,0.8617650344015126,0.5149196633511859,0.0766059512045479
GO:0002227,Innate Immune Response In Mucosa,0.8659829735001862,0.6434696064921145,0.0925888620749908
GO:0031664,Regulation Of Lipopolysaccharide-Mediated Signaling Pathway,0.8659829735001862,0.6434696064921145,0.0925888620749908
GO:0010526,Retrotransposon Silencing,0.8659829735001862,0.6434696064921145,0.0925888620749908
GO:0043547,Positive Regulation Of GTPase Activity,0.8685833647855359,0.859965981134993,0.1211620783290183
GO:0051084,'De Novo' Post-Translational Protein Folding,0.8691928097918016,0.6862745098039216,0.0962090313661615
GO:0016051,Carbohydrate Biosynthetic Process,0.8747339340349117,0.6501974691706295,0.0870195126527688
GO:0010529,Negative Regulation Of Transposition,0.8747339340349117,0.6501974691706295,0.0870195126527688
GO:0046337,Phosphatidylethanolamine Metabolic Process,0.8747339340349117,0.6501974691706295,0.0870195126527688
GO:0001914,Regulation Of T Cell Mediated Cytotoxicity,0.8790693647280108,0.6862264440018385,0.0884487359312272
GO:0006067,Ethanol Metabolic Process,0.8852657726340046,0.5616102862390938,0.0684419691086206
GO:0015749,Monosaccharide Transmembrane Transport,0.8852657726340046,0.5616102862390938,0.0684419691086206
GO:0001911,Negative Regulation Of Leukocyte Mediated Cytotoxicity,0.8852657726340046,0.5616102862390938,0.0684419691086206
GO:0048025,"Negative Regulation Of mRNA Splicing, Via Spliceosome",0.8852657726340046,0.5616102862390938,0.0684419691086206
GO:0034116,Positive Regulation Of Heterotypic Cell-Cell Adhesion,0.8852657726340046,0.5616102862390938,0.0684419691086206
GO:0031644,Regulation Of Nervous System Process,0.8878909483652124,0.5883124835972355,0.0699540897464433
GO:0048713,Regulation Of Oligodendrocyte Differentiation,0.8878909483652124,0.5883124835972355,0.0699540897464433
GO:2000434,Regulation Of Protein Neddylation,0.8878909483652124,0.5883124835972355,0.0699540897464433
GO:0006054,N-acetylneuraminate Metabolic Process,0.8881342853605596,0.514845423936333,0.0610773097447102
GO:0032486,Rap Protein Signal Transduction,0.8881342853605596,0.514845423936333,0.0610773097447102
GO:0034311,Diol Metabolic Process,0.8881342853605596,0.514845423936333,0.0610773097447102
GO:0090557,Establishment Of Endothelial Intestinal Barrier,0.8881342853605596,0.514845423936333,0.0610773097447102
GO:0097250,Mitochondrial Respirasome Assembly,0.8881342853605596,0.514845423936333,0.0610773097447102
GO:0030948,Negative Regulation Of Vascular Endothelial Growth Factor Receptor Signaling Pathway,0.8881342853605596,0.514845423936333,0.0610773097447102
GO:2000052,Positive Regulation Of Non-Canonical Wnt Signaling Pathway,0.8881342853605596,0.514845423936333,0.0610773097447102
GO:1904292,Regulation Of ERAD Pathway,0.8881342853605596,0.514845423936333,0.0610773097447102
GO:2001198,Regulation Of Dendritic Cell Differentiation,0.8881342853605596,0.514845423936333,0.0610773097447102
GO:1900363,Regulation Of mRNA Polyadenylation,0.8881342853605596,0.514845423936333,0.0610773097447102
GO:0034163,Regulation Of Toll-Like Receptor 9 Signaling Pathway,0.8881342853605596,0.514845423936333,0.0610773097447102
GO:0034695,Response To Prostaglandin E,0.8881342853605596,0.514845423936333,0.0610773097447102
GO:0043129,Surfactant Homeostasis,0.8881342853605596,0.514845423936333,0.0610773097447102
GO:0051017,Actin Filament Bundle Assembly,0.8913176631370936,0.6587745098039216,0.0757948998782881
GO:0018200,Peptidyl-Glutamic Acid Modification,0.8927060922000867,0.6055734190782422,0.0687312970423589
GO:0001912,Positive Regulation Of Leukocyte Mediated Cytotoxicity,0.8956800127244023,0.7041400066162647,0.0775765539649478
GO:0019262,N-acetylneuraminate Catabolic Process,0.9069510674282062,0.4119051262433053,0.0402294474429379
GO:0090527,Actin Filament Reorganization,0.9069510674282062,0.4119051262433053,0.0402294474429379
GO:0048846,Axon Extension Involved In Axon Guidance,0.9069510674282062,0.4119051262433053,0.0402294474429379
GO:0071221,Cellular Response To Bacterial Lipopeptide,0.9069510674282062,0.4119051262433053,0.0402294474429379
GO:0036089,Cleavage Furrow Formation,0.9069510674282062,0.4119051262433053,0.0402294474429379
GO:0010994,Free Ubiquitin Chain Polymerization,0.9069510674282062,0.4119051262433053,0.0402294474429379
GO:0046476,Glycosylceramide Biosynthetic Process,0.9069510674282062,0.4119051262433053,0.0402294474429379
GO:0060347,Heart Trabecula Formation,0.9069510674282062,0.4119051262433053,0.0402294474429379
GO:0048874,Host-Mediated Regulation Of Intestinal Microbiota Composition,0.9069510674282062,0.4119051262433053,0.0402294474429379
GO:0006020,Inositol Metabolic Process,0.9069510674282062,0.4119051262433053,0.0402294474429379
GO:0042758,Long-Chain Fatty Acid Catabolic Process,0.9069510674282062,0.4119051262433053,0.0402294474429379
GO:0045605,Negative Regulation Of Epidermal Cell Differentiation,0.9069510674282062,0.4119051262433053,0.0402294474429379
GO:1901533,Negative Regulation Of Hematopoietic Progenitor Cell Differentiation,0.9069510674282062,0.4119051262433053,0.0402294474429379
GO:1902284,Neuron Projection Extension Involved In Neuron Projection Guidance,0.9069510674282062,0.4119051262433053,0.0402294474429379
GO:0098943,"Neurotransmitter Receptor Transport, Postsynaptic Endosome To Lysosome",0.9069510674282062,0.4119051262433053,0.0402294474429379
GO:2000321,Positive Regulation Of T-helper 17 Cell Differentiation,0.9069510674282062,0.4119051262433053,0.0402294474429379
GO:0010536,Positive Regulation Of Activation Of Janus Kinase Activity,0.9069510674282062,0.4119051262433053,0.0402294474429379
GO:1903238,Positive Regulation Of Leukocyte Tethering Or Rolling,0.9069510674282062,0.4119051262433053,0.0402294474429379
GO:0034141,Positive Regulation Of Toll-Like Receptor 3 Signaling Pathway,0.9069510674282062,0.4119051262433053,0.0402294474429379
GO:0035608,Protein Deglutamylation,0.9069510674282062,0.4119051262433053,0.0402294474429379
GO:0090481,Pyrimidine Nucleotide-Sugar Transmembrane Transport,0.9069510674282062,0.4119051262433053,0.0402294474429379
GO:0032483,Regulation Of Rab Protein Signal Transduction,0.9069510674282062,0.4119051262433053,0.0402294474429379
GO:1903593,Regulation Of Histamine Secretion By Mast Cell,0.9069510674282062,0.4119051262433053,0.0402294474429379
GO:1902412,Regulation Of Mitotic Cytokinesis,0.9069510674282062,0.4119051262433053,0.0402294474429379
GO:1904182,Regulation Of Pyruvate Dehydrogenase Activity,0.9069510674282062,0.4119051262433053,0.0402294474429379
GO:1901077,Regulation Of Relaxation Of Muscle,0.9069510674282062,0.4119051262433053,0.0402294474429379
GO:0043576,Regulation Of Respiratory Gaseous Exchange,0.9069510674282062,0.4119051262433053,0.0402294474429379
GO:0034155,Regulation Of Toll-Like Receptor 7 Signaling Pathway,0.9069510674282062,0.4119051262433053,0.0402294474429379
GO:0032329,Serine Transport,0.9069510674282062,0.4119051262433053,0.0402294474429379
GO:0098814,Spontaneous Synaptic Transmission,0.9069510674282062,0.4119051262433053,0.0402294474429379
GO:0048280,Vesicle Fusion With Golgi Apparatus,0.9069510674282062,0.4119051262433053,0.0402294474429379
GO:0071526,Semaphorin-Plexin Signaling Pathway,0.910218231868043,0.6333898944193062,0.0595835529742496
GO:0009952,Anterior/Posterior Pattern Specification,0.9105392003795314,0.7015795123447324,0.0657508581944028
GO:0071621,Granulocyte Chemotaxis,0.9119292054105872,0.7240038872691934,0.0667480306972817
GO:0006491,N-glycan Processing,0.9124892723872204,0.5490508266993264,0.0502814981412833
GO:0042044,Fluid Transport,0.9124892723872204,0.5490508266993264,0.0502814981412833
GO:0048843,Negative Regulation Of Axon Extension Involved In Axon Guidance,0.9124892723872204,0.5490508266993264,0.0502814981412833
GO:0034587,piRNA Processing,0.9124892723872204,0.5490508266993264,0.0502814981412833
GO:0071294,Cellular Response To Zinc Ion,0.9127805924228588,0.5147711617939691,0.0469778835419592
GO:0090382,Phagosome Maturation,0.9127805924228588,0.5147711617939691,0.0469778835419592
GO:0046173,Polyol Biosynthetic Process,0.9127805924228588,0.5147711617939691,0.0469778835419592
GO:0009101,Glycoprotein Biosynthetic Process,0.9133056235696732,0.7323516786555146,0.0664130980484514
GO:0042059,Negative Regulation Of Epidermal Growth Factor Receptor Signaling Pathway,0.9146902785261044,0.5718879191548002,0.0509951110271278
GO:0061099,Negative Regulation Of Protein Tyrosine Kinase Activity,0.9146902785261044,0.5718879191548002,0.0509951110271278
GO:0042742,Defense Response To Bacterium,0.9168005071518732,0.81672002605235,0.0709446952906175
GO:0030593,Neutrophil Chemotaxis,0.917432775361774,0.7122760639176717,0.0613810814981137
GO:0016556,mRNA Modification,0.9180934881163424,0.5881863924742945,0.0502640884938966
GO:0031109,Microtubule Polymerization Or Depolymerization,0.9180934881163424,0.5881863924742945,0.0502640884938966
GO:0031110,Regulation Of Microtubule Polymerization Or Depolymerization,0.9180934881163424,0.5881863924742945,0.0502640884938966
GO:0043562,Cellular Response To Nitrogen Levels,0.9184610298769712,0.4576063666972758,0.0389220770837541
GO:0006995,Cellular Response To Nitrogen Starvation,0.9184610298769712,0.4576063666972758,0.0389220770837541
GO:0002430,Complement Receptor Mediated Signaling Pathway,0.9184610298769712,0.4576063666972758,0.0389220770837541
GO:0048246,Macrophage Chemotaxis,0.9184610298769712,0.4576063666972758,0.0389220770837541
GO:2000515,"Negative Regulation Of CD4-positive, Alpha-Beta T Cell Activation",0.9184610298769712,0.4576063666972758,0.0389220770837541
GO:0031274,Positive Regulation Of Pseudopodium Assembly,0.9184610298769712,0.4576063666972758,0.0389220770837541
GO:1903236,Regulation Of Leukocyte Tethering Or Rolling,0.9184610298769712,0.4576063666972758,0.0389220770837541
GO:0031272,Regulation Of Pseudopodium Assembly,0.9184610298769712,0.4576063666972758,0.0389220770837541
GO:0099601,Regulation Of Neurotransmitter Receptor Activity,0.9213751882542812,0.6431964449892736,0.0526700416424
GO:0070098,Chemokine-Mediated Signaling Pathway,0.929542834655198,0.6699828130905772,0.0489505451393384
GO:0000470,Maturation Of LSU-rRNA,0.9321505394913752,0.5146968769136558,0.0361630937371852
GO:0050858,Negative Regulation Of Antigen Receptor-Mediated Signaling Pathway,0.9326024027907854,0.5417482613285626,0.0378011990495248
GO:0046688,Response To Copper Ion,0.9326024027907854,0.5417482613285626,0.0378011990495248
GO:0030204,Chondroitin Sulfate Metabolic Process,0.9341502138607988,0.4751380564942481,0.0323654660772773
GO:0050685,Positive Regulation Of mRNA Processing,0.9343735068293444,0.5614088820826952,0.038107884985758
GO:0070534,Protein K63-linked Ubiquitination,0.935920585475128,0.6524717416421443,0.0432097131700649
GO:0046348,Amino Sugar Catabolic Process,0.9373680866347788,0.3432287681713848,0.0221997754003393
GO:0032049,Cardiolipin Biosynthetic Process,0.9373680866347788,0.3432287681713848,0.0221997754003393
GO:0006751,Glutathione Catabolic Process,0.9373680866347788,0.3432287681713848,0.0221997754003393
GO:0098734,Macromolecule Depalmitoylation,0.9373680866347788,0.3432287681713848,0.0221997754003393
GO:1902369,Negative Regulation Of RNA Catabolic Process,0.9373680866347788,0.3432287681713848,0.0221997754003393
GO:1902750,Negative Regulation Of Cell Cycle G2/M Phase Transition,0.9373680866347788,0.3432287681713848,0.0221997754003393
GO:0106015,Negative Regulation Of Inflammatory Response To Wounding,0.9373680866347788,0.3432287681713848,0.0221997754003393
GO:0010519,Negative Regulation Of Phospholipase Activity,0.9373680866347788,0.3432287681713848,0.0221997754003393
GO:1990264,Peptidyl-Tyrosine Dephosphorylation Involved In Inactivation Of Protein Kinase Activity,0.9373680866347788,0.3432287681713848,0.0221997754003393
GO:0017121,Plasma Membrane Phospholipid Scrambling,0.9373680866347788,0.3432287681713848,0.0221997754003393
GO:0048227,Plasma Membrane To Endosome Transport,0.9373680866347788,0.3432287681713848,0.0221997754003393
GO:2000510,Positive Regulation Of Dendritic Cell Chemotaxis,0.9373680866347788,0.3432287681713848,0.0221997754003393
GO:0048714,Positive Regulation Of Oligodendrocyte Differentiation,0.9373680866347788,0.3432287681713848,0.0221997754003393
GO:0002084,Protein Depalmitoylation,0.9373680866347788,0.3432287681713848,0.0221997754003393
GO:0010533,Regulation Of Activation Of Janus Kinase Activity,0.9373680866347788,0.3432287681713848,0.0221997754003393
GO:2000508,Regulation Of Dendritic Cell Chemotaxis,0.9373680866347788,0.3432287681713848,0.0221997754003393
GO:0032429,Regulation Of Phospholipase A2 Activity,0.9373680866347788,0.3432287681713848,0.0221997754003393
GO:0010996,Response To Auditory Stimulus,0.9373680866347788,0.3432287681713848,0.0221997754003393
GO:0006493,Protein O-linked Glycosylation,0.9391292737668828,0.7154684328597372,0.0449329469020457
GO:0007175,Negative Regulation Of Epidermal Growth Factor-Activated Receptor Activity,0.9409158998699372,0.41181512090603,0.025080165395811
GO:0002827,Positive Regulation Of T-helper 1 Type Immune Response,0.9409158998699372,0.41181512090603,0.025080165395811
GO:0051931,Regulation Of Sensory Perception,0.9409158998699372,0.41181512090603,0.025080165395811
GO:0070741,Response To Interleukin-6,0.9409158998699372,0.41181512090603,0.025080165395811
GO:1902285,Semaphorin-Plexin Signaling Pathway Involved In Neuron Projection Guidance,0.9409158998699372,0.41181512090603,0.025080165395811
GO:0099560,Synaptic Membrane Adhesion,0.9409158998699372,0.41181512090603,0.025080165395811
GO:0070646,Protein Modification By Small Protein Removal,0.942021377637132,0.7344868473057836,0.0438689241935677
GO:0034341,Response To Type II Interferon,0.9465415737014856,0.6856967464702272,0.0376724437123038
GO:0009311,Oligosaccharide Metabolic Process,0.9488313662790808,0.6117717717717718,0.0321328182396979
GO:0061572,Actin Filament Bundle Organization,0.94911948117984,0.5541312723116981,0.0289370598195657
GO:0001916,Positive Regulation Of T Cell Mediated Cytotoxicity,0.94911948117984,0.5541312723116981,0.0289370598195657
GO:1990869,Cellular Response To Chemokine,0.9493904876128806,0.6401103955841766,0.0332441924654648
GO:0030521,Androgen Receptor Signaling Pathway,0.9505886448773376,0.4411668233802016,0.0223556258842839
GO:0007019,Microtubule Depolymerization,0.9505886448773376,0.4411668233802016,0.0223556258842839
GO:0042551,Neuron Maturation,0.9505886448773376,0.4411668233802016,0.0223556258842839
GO:0030206,Chondroitin Sulfate Biosynthetic Process,0.9574043739926944,0.3743495561677379,0.0162952240804262
GO:1901317,Regulation Of Flagellated Sperm Motility,0.9574043739926944,0.3743495561677379,0.0162952240804262
GO:0006465,Signal Peptide Processing,0.9574043739926944,0.3743495561677379,0.0162952240804262
GO:0042355,L-fucose Catabolic Process,0.9578428224495484,0.2941742266914416,0.0126705495908788
GO:0042354,L-fucose Metabolic Process,0.9578428224495484,0.2941742266914416,0.0126705495908788
GO:0019317,Fucose Catabolic Process,0.9578428224495484,0.2941742266914416,0.0126705495908788
